Property_ID,Title,Price_RM,Region,Subarea,Property_Type,Title_Type,Size_sqft,Bedrooms,Bathrooms,Agent_Firm,Listing_URL,Scraped_At
114227236,"(Full Loan) Desa Green, Taman Desa, 715sf Renovated, Near Mid Valley",365000,Kuala Lumpur,Taman Desa,Service Residence,Freehold,715,2,2,THE ROOF REALTY SDN. BHD.,https://www.mudah.my/view?ad_id=114227236,2026-05-24 13:30:28
113671216,(Luas : 4004 sq ft)-BANGLO SETINGKAT-FASA 1D-TAMAN JUASSEH SENTOSA,449800,Negeri Sembilan,Kuala Pilah,Bungalow House,Freehold,4004,4,2,MUHAMMAD HAFIZUDDIN BIN MOHD SALEHUDDIN,https://www.mudah.my/view?ad_id=113671216,2026-05-24 13:30:28
114840477,Casea Garden Setia Eco Garden Corner 2 storey terrace 2nd link lower,1080000,Johor,Gelang Patah,Terraced House,Freehold,2690,4,3,PropNex Realty Sdn. Bhd.,https://www.mudah.my/view?ad_id=114840477,2026-05-24 13:30:28
114840439,Fully Furnished Menara U seksyen 13 Shah Alam,310000,Selangor,Shah Alam,Service Residence,Leasehold,527,2,1,ESP PROPERTIES ,https://www.mudah.my/view?ad_id=114840439,2026-05-24 13:30:28
114840438,Single Storey Corner Lot House For Sale(Taman Sentosa Klang),520000,Selangor,Klang,1-storey Terraced House,Freehold,1600,3,2,U PLUS REALTY SDN BHD,https://www.mudah.my/view?ad_id=114840438,2026-05-24 13:30:28
114840437,FULLY FURNISHED 🔥 Seri Maya Condominium Jalan Jelatek Setiawangsa KL,598000,Kuala Lumpur,Setiawangsa,Condominium,Freehold,1127,3,3,MN Associates Sdn bhd,https://www.mudah.my/view?ad_id=114840437,2026-05-24 13:30:28
114840434,Double Storey Cornet Lot For Sale(Taman Sentosa Klang),600000,Selangor,Klang,2-storey Terraced House,Freehold,1750,3,3,U PLUS REALTY SDN BHD,https://www.mudah.my/view?ad_id=114840434,2026-05-24 13:30:28
114840443,Nusa bestari double storey terrace house mutiara rini sutera utama,768000,Johor,Skudai,2-storey Terraced House,Freehold,1400,4,3,The Roof Realty Sdn Bhd,https://www.mudah.my/view?ad_id=114840443,2026-05-24 13:30:28
113319950,Single Storey House 3 Room For Sell (Meru Klang),379000,Selangor,Klang,1-storey Terraced House,Freehold,1400,3,2,U PLUS REALTY SDN BHD,https://www.mudah.my/view?ad_id=113319950,2026-05-24 13:30:28
113954711,"(Full Loan) Desa Villa condo Taman Desa, 1160sf, 3room Near Mid Valley",460000,Kuala Lumpur,Taman Desa,Condominium,Freehold,1160,3,2,THE ROOF REALTY SDN. BHD.,https://www.mudah.my/view?ad_id=113954711,2026-05-24 13:30:28
114840476,Fully Renovated 3 bedroom 2 bathroom Unit open for sale !!,368000,Selangor,Klang,Apartment,Freehold,1290,3,2,GT NELSON REALTY SDN BHD,https://www.mudah.my/view?ad_id=114840476,2026-05-24 13:30:28
113476727,Dato Onn/Freehold/1-3bed/CIQ 15MINS/Ready 2026/Shuttle Bus/Furnished,220000,Johor,Johor Bahru,Condominium,Freehold,900,3,2,IPG,https://www.mudah.my/view?ad_id=113476727,2026-05-24 13:30:28
114840475,"PALING MURAH! Single Storey Terrace, Taman Gadong Jaya, Labu",238000,Negeri Sembilan,Labu,1-storey Terraced House,Freehold,1300,3,2,IQI Realty Sdn Bhd,https://www.mudah.my/view?ad_id=114840475,2026-05-24 13:30:28
114840463,Pangsapuri Nusa Indah Level 3 Bukit Mertajam,200000,Penang,Bukit Mertajam,Apartment,Freehold,904,3,2,OD Legacy Realty,https://www.mudah.my/view?ad_id=114840463,2026-05-24 13:30:28
114840459,Melaka Subsale Subrent Jonker Street 黄金地段商铺出售,1880000,Melaka,Melaka Raya,Shop lot,Freehold,1598,,,IQI REALTY SDN BHD,https://www.mudah.my/view?ad_id=114840459,2026-05-24 13:30:28
114840458,Renovated Double Storey Terrace Seksyen 4 Bandar Baru Bangi,530000,Selangor,Bangi,2-storey Terraced House,Leasehold,1500,6,3,Era Realtor Sdn Bhd,https://www.mudah.my/view?ad_id=114840458,2026-05-24 13:30:28
114745370,Elit Heights in Bayan Baru 1123sf Fully Furnished Renovated High Floor,525000,Penang,Bayan Lepas,Condominium,Freehold,1123,3,2,Centeline Asia,https://www.mudah.my/view?ad_id=114745370,2026-05-24 13:30:28
114320900,Midas/ Perling/ 3bedrooms/  Full Loan/ Fully Renovated,450000,Johor,Johor Bahru,Apartment,Freehold,926,3,2,propnex realty sdn.bhd,https://www.mudah.my/view?ad_id=114320900,2026-05-24 13:30:28
114781938,Fiera Vista in Bayan Lepas 1400sf Basic Unit 4 Bedrooms Corner Unit,638000,Penang,Bayan Lepas,Condominium,Freehold,1400,4,3,Centeline Asia,https://www.mudah.my/view?ad_id=114781938,2026-05-24 13:30:28
114669793,Perling Heights/ Fully Renovated/ Full Loan,278000,Johor,Johor Bahru,Apartment,Freehold,641,1,1,propnex realty sdn.bhd,https://www.mudah.my/view?ad_id=114669793,2026-05-24 13:30:28
114706859,Larkin Heights/ 2carparks/ Full Loan/ Fully Renovated,385000,Johor,Johor Bahru,Apartment,Leasehold,916,3,2,propnex realty sdn.bhd,https://www.mudah.my/view?ad_id=114706859,2026-05-24 13:30:28
114195248,End Lot Double Storey Taman Kajang Prima Kajang,520000,Selangor,Kajang,2-storey Terraced House,Freehold,2000,4,4,IQI Realty Sdn Bhd,https://www.mudah.my/view?ad_id=114195248,2026-05-24 13:30:28
114773357,Indah Court/ Bukit Indah/ ROI 9%/ 5 bedrooms/ Full Loan,375000,Johor,Johor Bahru,Apartment,Freehold,850,5,2,propnex realty sdn.bhd,https://www.mudah.my/view?ad_id=114773357,2026-05-24 13:30:28
114654134,Ground Floor Good Year Cort 10 for sale- below Mv,340000,Selangor,Subang Jaya,Apartment,Freehold,829,3,2,Maxxan Realty Sdn Bhd,https://www.mudah.my/view?ad_id=114654134,2026-05-24 13:30:28
114605302,Beautifully double storey  in USJ9 renovated house - Facing open,890000,Selangor,Subang Jaya,2-storey Terraced House,Freehold,1650,4,3,Maxxan Realty Sdn Bhd,https://www.mudah.my/view?ad_id=114605302,2026-05-24 13:30:28
113658150,"Cheapest Double Storey Terrace,  Seksyen 10 Putra Permai Putra Heights",645000,Selangor,Putra Heights,2-storey Terraced House,Freehold,1400,4,3,Maxxan Realty Sdn Bhd,https://www.mudah.my/view?ad_id=113658150,2026-05-24 13:30:28
114784788,FOR SALE | USJ 6 – Intermediate Terrace House (Walking Distance to LRT,770000,Selangor,Subang Jaya,2-storey Terraced House,Freehold,1200,4,2,Maxxan Realty Sdn Bhd,https://www.mudah.my/view?ad_id=114784788,2026-05-24 13:30:28
114840394,Botani Ipoh FREEHOLD Double Storey House Nice Renovated Unit,390000,Perak,Ipoh,2-storey Terraced House,Freehold,1080,4,3,E Trend Realty Sdn Bhd,https://www.mudah.my/view?ad_id=114840394,2026-05-24 13:30:28
114826252,Freehold End Lot 2 Storey Semi-D @ Taman Melawati,1950000,Kuala Lumpur,Taman Melawati,Semi-Detached House,Freehold,3241,4,3,Raine Horne International Zaki & Partners Sdn Bhd,https://www.mudah.my/view?ad_id=114826252,2026-05-24 13:30:28
114218614,Double Storey Tropicana Golf & Country Resort Petaling Jaya,870000,Selangor,Petaling Jaya,2-storey Terraced House,Leasehold,2000,4,3,PROTASA PROPERTIES,https://www.mudah.my/view?ad_id=114218614,2026-05-24 13:30:28
113815543,"Double Storey Terrace SS14, Subang Jaya",770000,Selangor,Subang Jaya,2-storey Terraced House,Freehold,2100,4,3,IQI Realty Sdn Bhd,https://www.mudah.my/view?ad_id=113815543,2026-05-24 13:30:28
114070750,Glomac Damansara TTDI 2+1 Room For Sale(TTDI KL),890000,Kuala Lumpur,Taman Tun Dr Ismail,Service Residence,Freehold,1022,3,2,U PLUS REALTY SDN BHD,https://www.mudah.my/view?ad_id=114070750,2026-05-24 13:30:28
114840393,"Rumah Teres Setingkat Taman Nusa Damai, Corner Lot Untuk Dijual",580000,Johor,Pasir Gudang,1-storey Terraced House,Freehold,3455,3,2,NITA SAHARI PROPERTIES,https://www.mudah.my/view?ad_id=114840393,2026-05-24 13:30:28
114840388,Taman Gembira Klang 1 storey House 22x75 Reno Extended Freehold Sale,499000,Selangor,Klang,1-storey Terraced House,Freehold,1650,3,2,The Roof Realty,https://www.mudah.my/view?ad_id=114840388,2026-05-24 13:30:28
114679976,Damai Jaya Skudai Doubel Storey LC for Sale FULL LOAN,358000,Johor,Skudai,2-storey Terraced House,Freehold,770,3,2,Win Development PLT,https://www.mudah.my/view?ad_id=114679976,2026-05-24 13:30:28
114674018,Bandar Baru Uda LIMITED Single Storey Terrace for sale,530000,Johor,Johor Bahru,1-storey Terraced House,Freehold,1650,3,2,Win Development PLT,https://www.mudah.my/view?ad_id=114674018,2026-05-24 13:30:28
114840419,"[Renovated] Double Storey @ Taman Mok Sum, off Jalan Rasah Seremban",450000,Negeri Sembilan,Rasah,2-storey Terraced House,Leasehold,1700,3,4,Landsworth Property,https://www.mudah.my/view?ad_id=114840419,2026-05-24 13:30:28
114227975,Anggun Puri Dutamas,320000,Kuala Lumpur,Solaris Dutamas,Condominium,Freehold,850,3,2,CHESTER PROPERTIES SDN BHD,https://www.mudah.my/view?ad_id=114227975,2026-05-24 13:30:28
114501477,Sri Skudai Single Storey LC for sale,435000,Johor,Skudai,1-storey Terraced House,Freehold,1100,3,2,Win Development PLT,https://www.mudah.my/view?ad_id=114501477,2026-05-24 13:30:28
114840417,Taman Megah Cheras Apartment,198000,Selangor,Cheras,Apartment,Freehold,808,3,2,Tech Real Estate Sdn Bhd,https://www.mudah.my/view?ad_id=114840417,2026-05-24 13:30:28
114840416,"BERBALOI!! Ostia Residensi Seksyen 14, Bandar Baru Bangi",440000,Selangor,Bangi,Apartment,Leasehold,850,4,2,Azmi Real Estate Agency Sdn Bhd,https://www.mudah.my/view?ad_id=114840416,2026-05-24 13:30:28
110080904,Non Bumi Lot | Freehold | 4b 3b | Double Storey Semi-D Tasik Kesuma,785000,Selangor,Semenyih,Semi-Detached House,Freehold,3498,4,3,IQI Realty Sdn Bhd,https://www.mudah.my/view?ad_id=110080904,2026-05-24 13:30:28
114840414,BERBALOI!!! Bungalow 2-Storey Taman Ampang Jaya,2400000,Selangor,Ampang,Bungalow House,Leasehold,4000,5,5,Azmi Real Estate Agency Sdn Bhd,https://www.mudah.my/view?ad_id=114840414,2026-05-24 13:30:28
114840413,"BERBALOI! 2.5-Storey Semi-D Puncak Bangi, Seksyen 6, Bandar Baru Bangi",1590000,Selangor,Bangi,Semi-Detached House,Leasehold,3965,7,6,Azmi Real Estate Agency Sdn Bhd,https://www.mudah.my/view?ad_id=114840413,2026-05-24 13:30:28
114840412,"PALING MURAH!!! 1-Storey Taman Johan Setia Permai, Klang",360000,Selangor,Klang,1-storey Terraced House,Leasehold,900,3,2,Azmi Real Estate Agency Sdn Bhd,https://www.mudah.my/view?ad_id=114840412,2026-05-24 13:30:28
114840411,Rumah Teres Setingkat di Bandar Selesa Jaya Untuk Dijual,478000,Johor,Skudai,1-storey Terraced House,Freehold,1540,3,2,NITA SAHARI PROPERTIES,https://www.mudah.my/view?ad_id=114840411,2026-05-24 13:30:28
114769523,Freehold 2 Storey Bungalow in Subang Alam Fully Renovated,1850000,Selangor,Shah Alam,Bungalow House,Freehold,4629,5,4,GLOW ESTATE SDN BHD,https://www.mudah.my/view?ad_id=114769523,2026-05-24 13:30:28
114840407,"PALING MURAH+LOW LEVEL🔥 Flat PKNS Seksyen 24, Shah Alam",170000,Selangor,Shah Alam,Flat,Leasehold,602,2,1,IQI REALTY SDN BHD,https://www.mudah.my/view?ad_id=114840407,2026-05-24 13:30:28
114840385,"2 Storey Terrace Seksyen 4, Bandar Baru Bangi for Sale",530000,Selangor,Bangi,2-storey Terraced House,Leasehold,1900,6,3,Great Casa Realty Sdn Bhd,https://www.mudah.my/view?ad_id=114840385,2026-05-24 13:30:28
114840379,[Open Facing] Rumah Teres 1 Tingkat Suku di Kempadang Aman Kuantan,270000,Pahang,Kuantan,1-storey Terraced House,Freehold,1399,3,3,AFZ Reality Sdn Bhd,https://www.mudah.my/view?ad_id=114840379,2026-05-24 13:30:28
113774260,"Semi D Taman Sri Ukay, Ulu Klang, Ampang",2000000,Selangor,Ulu Klang,Semi-Detached House,Freehold,3500,5,5,IQI Realty Sdn Bhd,https://www.mudah.my/view?ad_id=113774260,2026-05-24 13:30:28
114228473,Double Sty Terrace House Taman Selayang Mulia [RENOVATED],560000,Selangor,Selayang,Terraced House,Leasehold,1720,4,4,CHESTER PROPERTIES SDN BHD,https://www.mudah.my/view?ad_id=114228473,2026-05-24 13:30:28
114840405,“brand new single storey terrace j1 residence jenderam dengkil freehol,450000,Selangor,Dengkil,Terraced House,Freehold,1040,4,2,CHESTER PROPERTIES,https://www.mudah.my/view?ad_id=114840405,2026-05-24 13:30:28
113440397,Setia Tropical/CIQ 10mins/1-2Beds/Ready Unit/Freehold/Complete 2026,300000,Johor,Johor Bahru,Condominium,Freehold,753,2,2,IPG,https://www.mudah.my/view?ad_id=113440397,2026-05-24 13:30:28
114589468,Ridzuan Condominium 1468sqf 3 Room For Sell(Bandar Sunway Subang Jaya),420000,Selangor,Bandar Sunway,Condominium,Leasehold,1468,3,2,U PLUS REALTY SDN BHD,https://www.mudah.my/view?ad_id=114589468,2026-05-24 13:30:28
111474329,Single Storey House For Sale (Taman Bukit Mewah Kajang),400000,Selangor,Kajang,1-storey Terraced House,Freehold,1400,3,2,U PLUS REALTY SDN BHD,https://www.mudah.my/view?ad_id=111474329,2026-05-24 13:30:28
111449149,Freehold/CIQ 12mins/Furnished/ETS/Invest/Dato Onn/Full Loan/1-2 Beds,219000,Johor,Johor Bahru,New Condominium,Freehold,646,2,2,IPG,https://www.mudah.my/view?ad_id=111449149,2026-05-24 13:30:28
114196718,3 Storey Renovated Link House Taman Dagang,550000,Selangor,Ampang,3-storey Terraced House,Leasehold,1800,3,3,Propnex Realty Sdn Bhd,https://www.mudah.my/view?ad_id=114196718,2026-05-24 13:30:28
113437914,Perling/CIQ 11Mins/2-3Bed/Dual Key/Cash Back/Furnished/Free Legal Fee,330000,Johor,Johor Bahru,Condominium,Leasehold,950,3,2,IPG,https://www.mudah.my/view?ad_id=113437914,2026-05-24 13:30:28
110637532,CIQ 15Min/Freehold/1-3bed/KTM/Foreigner/Shuttle Bus/Ready Unit/LPPSA,220000,Johor,Johor Bahru,Condominium,Freehold,893,3,2,IPG,https://www.mudah.my/view?ad_id=110637532,2026-05-24 13:30:28
114840399,"FREEHOLD 2.5 Storey Terrace, Jalan Terasek, Bangsar, KL",2200000,Kuala Lumpur,Bangsar,2.5-storey Terraced House,Freehold,3000,6,4,Gather Properties Sdn Bhd,https://www.mudah.my/view?ad_id=114840399,2026-05-24 13:30:28
111171465,Townhouse For sales(Bandar Saujana Putra),350000,Selangor,Bandar Saujana Putra,Townhouse,Leasehold,990,3,2,U PLUS REALTY SDN BHD,https://www.mudah.my/view?ad_id=111171465,2026-05-24 13:30:28
114840398,"Taman Kalien Batu 7, 1.5storeys Corner House For Sale ‼️",780000,Sarawak,Kuching,Semi-Detached House,Leasehold,5096,4,3,THE ROOF REALTY,https://www.mudah.my/view?ad_id=114840398,2026-05-24 13:30:28
113839398,Mentari Kondo Cheras Bandar Sri Permaisuri Under Market cheapest,365000,Kuala Lumpur,Cheras,Condominium,Leasehold,950,3,2,Private Seller,https://www.mudah.my/view?ad_id=113839398,2026-05-24 13:30:28
114784730,Premium Office Space Sunset Sea view 🪟 24/7 Security | Kota Kinabalu,1603980,Sabah,Kota Kinabalu,New Office space,Leasehold,2153,,,JESSELTON PROPERTY REAL ESTATE AGENCY SDN BHD,https://www.mudah.my/view?ad_id=114784730,2026-05-24 13:30:28
114726601,Taman Universiti jalan Kebangsaan Skudai Area Pulai,380000,Johor,Skudai,1-storey Terraced House,Freehold,1044,2,2,OD LEGACY REALTY SDN BHD,https://www.mudah.my/view?ad_id=114726601,2026-05-24 13:30:28
114765367,Jalan hang lekiu taman skudai baru,578000,Johor,Skudai,1-storey Terraced House,Freehold,1540,4,3,OD LEGACY REALTY SDN BHD,https://www.mudah.my/view?ad_id=114765367,2026-05-24 13:30:28
114533543,"Permas Freehold Seaview Condo , 10 mins to CIQ",360000,Johor,Permas Jaya,New Service Residence,Freehold,948,3,3,Gplex Realty Sdn Bhd,https://www.mudah.my/view?ad_id=114533543,2026-05-24 13:30:28
114840346,Setia Permai 3 @ Setia Alam 2-Storey House 18x65 Basic Unit - FOR SALE,635000,Selangor,Setia Alam,2-storey Terraced House,Freehold,1300,4,3,THE ROOF REALTY SDN BHD,https://www.mudah.my/view?ad_id=114840346,2026-05-24 13:30:28
111891863,Single Storey Taman Merdeka Batu Berendam Melaka,255000,Melaka,Batu Berendam,1-storey Terraced House,Leasehold,1100,3,2,MP Global Realty Sdn Bhd,https://www.mudah.my/view?ad_id=111891863,2026-05-24 13:30:28
108741338,"Office For Sale Taman Padang Balang, Batu Berendam, Melaka",110000,Melaka,Batu Berendam,Office space,Leasehold,623,,,MP Global Realty Sdn Bhd,https://www.mudah.my/view?ad_id=108741338,2026-05-24 13:30:28
113249957,"Double Storey For Sale Taman Asean, Melaka",598000,Melaka,Others,2-storey Terraced House,Freehold,1540,4,3,MP Global Realty Sdn Bhd,https://www.mudah.my/view?ad_id=113249957,2026-05-24 13:30:28
113249933,"Flat Apartment For Sale TAMAN ANIKA, 75250 KAMPUNG LAPAN MELAKA",79000,Melaka,Melaka City,Flat,Leasehold,520,2,1,MP Global Realty Sdn Bhd,https://www.mudah.my/view?ad_id=113249933,2026-05-24 13:30:28
113249918,"Single Storey For Sale Taman Muzaffar Shah , Ayer Keroh Melaka",320000,Melaka,Ayer Keroh,1-storey Terraced House,Leasehold,1539,3,2,MP Global Realty Sdn Bhd,https://www.mudah.my/view?ad_id=113249918,2026-05-24 13:30:28
114840342,"Wow Rumah Teres Dua Tingkat ‼️Taman Casa Innova ,Bandar Putra Bertam",480000,Penang,Bertam,2-storey Terraced House,Freehold,1539,4,3,HIT Properties,https://www.mudah.my/view?ad_id=114840342,2026-05-24 13:30:28
114840373,2 Storey Pre War Shop House at Georgetown UNESCO Zone.,1600000,Penang,Georgetown,Shop lot,Freehold,1413,,,MEGACITI REALTY,https://www.mudah.my/view?ad_id=114840373,2026-05-24 13:30:28
114706972,Below market price City Of Green Condo Seri Kembangan APU Bukit Jalil,330000,Selangor,Seri Kembangan,Service Residence,Freehold,1000,3,2,Knight World Realty M Sdn Bhd,https://www.mudah.my/view?ad_id=114706972,2026-05-24 13:30:28
112787280,"Non Bumi Lot | 22 x 70 | Double Storey Bandar Tasik Kesuma, Semenyih",565000,Selangor,Semenyih,2-storey Terraced House,Freehold,1734,4,3,IQI Realty Sdn Bhd,https://www.mudah.my/view?ad_id=112787280,2026-05-24 13:30:28
114547637,Non Bumi Lot | Freehold | 22x75 | Reno | Double Storey @ Semenyih,530000,Selangor,Semenyih,2-storey Terraced House,Freehold,1900,4,3,IQI Realty Sdn Bhd,https://www.mudah.my/view?ad_id=114547637,2026-05-24 13:30:28
113780086,"Non Bumi Lot | Freehold | 3 Storey Semi-D Saujana Suria, Kajang",1299000,Selangor,Kajang,Semi-Detached House,Freehold,3500,5,5,IQI Realty Sdn Bhd,https://www.mudah.my/view?ad_id=113780086,2026-05-24 13:30:28
114634891,CANTIK! 2 Storey Terrace Taman Bentara Teluk Panglima Garang,470000,Selangor,Telok Panglima Garang,2-storey Terraced House,Leasehold,1360,4,3,MN Associates Sdn bhd,https://www.mudah.my/view?ad_id=114634891,2026-05-24 13:30:28
114784046,"Non Bumi Lot | 1 Storey Bungalow @ Desa Pandan, Kuala Lumpur",1300000,Kuala Lumpur,Desa Pandan,Bungalow House,Leasehold,4763,7,3,IQI Realty Sdn Bhd,https://www.mudah.my/view?ad_id=114784046,2026-05-24 13:30:28
114840361,"[FOR SALE] Rumah Teres Setingkat di Kempadang Makmur, Kuantan",220000,Pahang,Kuantan,1-storey Terraced House,Leasehold,1302,3,2,AFZ Reality Sdn Bhd,https://www.mudah.my/view?ad_id=114840361,2026-05-24 13:30:28
114796971,"[Facing Empty Cantik‼️] Double sty Jln Bukit Permai,Ampang KL",668000,Kuala Lumpur,Ampang,2-storey Terraced House,Leasehold,1200,4,3,VPG REALTY,https://www.mudah.my/view?ad_id=114796971,2026-05-24 13:30:28
114634916,GOLF VIEW🔥2 Storey Semi D SIGC Seremban,1500000,Negeri Sembilan,Seremban,Semi-Detached House,Leasehold,4241,4,5,MN Associates Sdn bhd,https://www.mudah.my/view?ad_id=114634916,2026-05-24 13:30:28
114762892,{Sendayan Bungalow} {Resort Villa}– exclusive homes for refined living,3100000,Negeri Sembilan,Bandar Sri Sendayan,Bungalow House,Freehold,7749,10,6,Ding Feng,https://www.mudah.my/view?ad_id=114762892,2026-05-24 13:30:28
114793638,Elmina Valley 2 West Shah Alam 2 storey terraced house Freehold,810000,Selangor,Shah Alam,2-storey Terraced House,Freehold,1855,4,4,GLOW ESTATE SDN BHD,https://www.mudah.my/view?ad_id=114793638,2026-05-24 13:30:28
114793376,Aman Suria Damansara PJ 2 storey Semi-D House Gated & Guarded,3700000,Selangor,Petaling Jaya,Semi-Detached House,Freehold,4200,6,6,GLOW ESTATE SDN BHD,https://www.mudah.my/view?ad_id=114793376,2026-05-24 13:30:28
114769385,2 Storey Semi-Detached House Tropicana Golf & Country Resort 4000sqft,2750000,Selangor,Petaling Jaya,Semi-Detached House,Freehold,4000,4,5,GLOW ESTATE SDN BHD,https://www.mudah.my/view?ad_id=114769385,2026-05-24 13:30:28
113856897,"Apartment For Sale Pangsapuri Kota Laksamana , Klebang Melaka",95000,Melaka,Melaka City,Apartment,Leasehold,767,3,2,MP Global Realty Sdn Bhd,https://www.mudah.my/view?ad_id=113856897,2026-05-24 13:30:28
113856908,"Double Storey SEMI D For Sale Taman Desa Bertam, Tanjung Minyak",660000,Melaka,Bertam,Semi-Detached House,Freehold,3200,4,4,MP Global Realty Sdn Bhd,https://www.mudah.my/view?ad_id=113856908,2026-05-24 13:30:28
113856905,"Shop Office For Sale Pandan Malim, Melaka",440000,Melaka,Bachang,Shop lot,Leasehold,2033,,,MP Global Realty Sdn Bhd,https://www.mudah.my/view?ad_id=113856905,2026-05-24 13:30:28
113855370,"Single Storey Bungalow For Sale Taman Belimbing Setia, Durian Tunggal",550000,Melaka,Durian Tunggal,Bungalow House,Freehold,4500,4,2,MP Global Realty Sdn Bhd,https://www.mudah.my/view?ad_id=113855370,2026-05-24 13:30:28
114840357,"1 Storey Terrace, Seksyen 2, Bandar Baru Bangi for Sale",435000,Selangor,Bangi,1-storey Terraced House,Leasehold,1210,4,3,Great Casa Realty Sdn Bhd,https://www.mudah.my/view?ad_id=114840357,2026-05-24 13:30:28
113855509,"SEMI D For Sale Taman Rembia Perkasa, Alor Gajah Melaka",600000,Melaka,Rembia,Semi-Detached House,Freehold,3200,4,3,MP Global Realty Sdn Bhd,https://www.mudah.my/view?ad_id=113855509,2026-05-24 13:30:28
114510235,"FULLY RENOVATED! 2 Storey Terrace Bandar Nusaputra, Puchong",630000,Selangor,Puchong,2-storey Terraced House,Leasehold,1600,4,3,MN Associates Sdn bhd,https://www.mudah.my/view?ad_id=114510235,2026-05-24 13:30:28
113856017,Single Storey For Sale Taman Bukit Senjuang Semabok Melaka,475000,Melaka,Semabok,1-storey Terraced House,Freehold,1300,3,2,MP Global Realty Sdn Bhd,https://www.mudah.my/view?ad_id=113856017,2026-05-24 13:30:28
113855733,"Hotel Shop Lot For Sale Taman Kota Laksamana, Melaka",3980000,Melaka,Melaka City,Hotel / Resort,Leasehold,1540,,,MP Global Realty Sdn Bhd,https://www.mudah.my/view?ad_id=113855733,2026-05-24 13:30:28
113856802,3 Storey Shop Lot For Sale Taman Bachang Jaya Melaka,750000,Melaka,Bachang,Shop lot,Freehold,1540,,,MP Global Realty Sdn Bhd,https://www.mudah.my/view?ad_id=113856802,2026-05-24 13:30:28
114715271,Full Loan Cash Out Nusa Indah Bukit Indah unblock 20x70 gated guarded,665000,Johor,Iskandar Puteri,2-storey Terraced House,Freehold,1400,4,3,The Roof Realty,https://www.mudah.my/view?ad_id=114715271,2026-05-24 13:30:28
114819327,Apartment 2 Tingkat Danga Bay - Beli Dengan Modal RM299 Je,600000,Johor,Skudai,Apartment,Freehold,2109,4,5,Private Seller,https://www.mudah.my/view?ad_id=114819327,2026-05-24 13:30:28
111044203,"Pulai Hijauan , Full Loan , Kangkar Pulai,Mutiara , Nearby Pulai Jaya",493000,Johor,Skudai,2-storey Terraced House,Freehold,1300,4,3,VAG Properties,https://www.mudah.my/view?ad_id=111044203,2026-05-24 13:30:28
114694552,Kalista 2 Condo 4 Room for Sale(Seremban 2 Seremban),420000,Negeri Sembilan,Seremban 2,Apartment,Freehold,1076,4,2,U PLUS REALTY SDN BHD,https://www.mudah.my/view?ad_id=114694552,2026-05-24 13:30:28
113948772,Trio Setia Residence 1+1 Room For Sell(Bukit Tinggi Klang),430000,Selangor,Bandar Bukit Tinggi,Service Residence,Freehold,656,2,1,U PLUS REALTY SDN BHD,https://www.mudah.my/view?ad_id=113948772,2026-05-24 13:30:28
114084466,MURAH! Double Storey Terrace USJ 11 Subang Jaya,880000,Selangor,USJ,2-storey Terraced House,Freehold,1650,3,3,MN Associates Sdn bhd,https://www.mudah.my/view?ad_id=114084466,2026-05-24 13:30:28
114840347,Apartment Seri Paya Mengkuang Gelang Patah,220000,Johor,Gelang Patah,Apartment,Leasehold,796,3,2,Esp Properties Sdn Bhd,https://www.mudah.my/view?ad_id=114840347,2026-05-24 13:30:28
114656046,4 bedroom for sale in Platinum Melati Setapak,400000,Kuala Lumpur,Setapak,Condominium,Freehold,1242,4,2,CBD PROPERTIES SDN BHD,https://www.mudah.my/view?ad_id=114656046,2026-05-24 13:30:28
114697657,"Kajang Mewah Apartment 2 Room For Sale(Taman Kajang Mewah, Kajang)",160000,Selangor,Kajang,Apartment,Freehold,700,2,1,U PLUS REALTY SDN BHD,https://www.mudah.my/view?ad_id=114697657,2026-05-24 13:30:28
110379754,Villa Laman Tasik Under Market 100% loan cash back,519000,Kuala Lumpur,Cheras,Others,Leasehold,1600,4,3,Private Seller,https://www.mudah.my/view?ad_id=110379754,2026-05-24 13:30:28
113234085,[Booking 1k] Suria Ixora Apartment [Boleh Mark Up] Setia Alam,245000,Selangor,Shah Alam,Apartment,Freehold,700,3,2,Era Realtor Sdn Bhd,https://www.mudah.my/view?ad_id=113234085,2026-05-24 13:30:28
113911122,3 Storey Semi D with Lift 🔥 New House | Taman LIFO Kolombong | CCTV,2450000,Sabah,Kota Kinabalu,Semi-Detached House,Leasehold,5400,6,7,JESSELTON PROPERTY REAL ESTATE AGENCY SDN BHD,https://www.mudah.my/view?ad_id=113911122,2026-05-24 13:30:28
113910859,Grand Meridian Kepayan 🔥 Semi D concept Condo | High End Low Density,567840,Sabah,Penampang,Condominium,Leasehold,1050,3,2,JESSELTON PROPERTY REAL ESTATE AGENCY SDN BHD,https://www.mudah.my/view?ad_id=113910859,2026-05-24 13:30:28
114746860,"For Sale - Flat Taman Desa Rakyat Perdana, Pasir Gudang",145000,Johor,Pasir Gudang,Others,Leasehold,650,3,2,IM GLOBAL PROPERTY CONSULTANTS SDN BHD,https://www.mudah.my/view?ad_id=114746860,2026-05-24 13:30:28
114558186,CORNER LOT! 2 Storey Terrace Lestari Perdana 8 Seri Kembangan,800000,Selangor,Seri Kembangan,2-storey Terraced House,Leasehold,3010,6,3,MN Associates Sdn bhd,https://www.mudah.my/view?ad_id=114558186,2026-05-24 13:30:28
114083544,FACING OPEN! 3 Storey Superlink Schumann Symphony Hills Cyberjaya,1200000,Selangor,Cyberjaya,3-storey Terraced House,Freehold,1950,6,6,MN Associates Sdn bhd,https://www.mudah.my/view?ad_id=114083544,2026-05-24 13:30:28
114510229,RENOVATED! 2 Storey Terrace Laurel Laman View Cyberjaya,800000,Selangor,Cyberjaya,2-storey Terraced House,Freehold,1647,5,3,MN Associates Sdn bhd,https://www.mudah.my/view?ad_id=114510229,2026-05-24 13:30:28
105777967,"100% Loan, The Holmes 2 Condo Bandar Tun Razak Cheras Below Value",420000,Kuala Lumpur,Cheras,Condominium,Leasehold,980,3,2,THE ROOF REALTY SDN. BHD.,https://www.mudah.my/view?ad_id=105777967,2026-05-24 13:30:28
112328958,The V by Jesselton 💎 Likas Bay | Airbnb Service Suite | Sea View | KK,298350,Sabah,Kota Kinabalu,Service Residence,Leasehold,425,1,1,JESSELTON PROPERTY REAL ESTATE AGENCY SDN BHD,https://www.mudah.my/view?ad_id=112328958,2026-05-24 13:30:28
114320612,Damai Suites Airbnb Fully Furnished Completed soon near KPJ QE2 Damai,316030,Sabah,Kota Kinabalu,Service Residence,Leasehold,303,1,1,JESSELTON PROPERTY REAL ESTATE AGENCY SDN BHD,https://www.mudah.my/view?ad_id=114320612,2026-05-24 13:30:28
