url,job_id,title,company,salary,job_type,location,experience_level,date_posted,skills,source_combo
https://www.maukerja.my/job/17979537-health-advisor-mydin-jengka-pahang,17979537,Health Advisor ( MYDIN JENGKA PAHANG ),Watsons Personal Care Stores Sdn Bhd,"Up to MYR2,100 Sebulan",N/A,Pahang,"Up to MYR2,100 Sebulan",8 days ago,Any Skill,part-time-all
https://www.maukerja.my/job/17979518-health-advisor-wangsa-walk-relocation,17979518,Health Advisor ( WANGSA WALK (RELOCATION) ),Watsons Personal Care Stores Sdn Bhd,"Up to MYR2,100 Sebulan",N/A,"Wangsa Maju, WP Kuala Lumpur","Up to MYR2,100 Sebulan",8 days ago,Any Skill,part-time-all
https://www.maukerja.my/job/17979538-health-advisor-jerantut-relocation-from-m247,17979538,Health Advisor ( JERANTUT (RELOCATION FROM M247) ),Watsons Personal Care Stores Sdn Bhd,"Up to MYR2,100 Sebulan",N/A,"Jerantut, Pahang","Up to MYR2,100 Sebulan",8 days ago,Any Skill,part-time-all
https://www.maukerja.my/job/17979553-health-advisor-dataran-pahlawan-2,17979553,Health Advisor ( DATARAN PAHLAWAN 2 ),Watsons Personal Care Stores Sdn Bhd,"Up to MYR2,100 Sebulan",N/A,Melaka,"Up to MYR2,100 Sebulan",8 days ago,Any Skill,part-time-all
https://www.maukerja.my/job/26269093-personal-assistant,26269093,Personal Assistant,Yew Sow Wah,"MYR2,500 - MYR3,500 Sebulan",Separuh Masa,WP Kuala Lumpur,"MYR2,500 - MYR3,500 Sebulan",4 hours ago,"Secretarial, PC Skill",part-time-all
https://www.maukerja.my/job/26269576-eksekutif-akaun,26269576,Eksekutif Akaun,WSE Co,"MYR1,800 - MYR3,800 Sehari",Separuh Masa,"Perai, Pulau Pinang","MYR1,800 - MYR3,800 Sehari",3 hours ago,"Financial Management, Bookeeping",part-time-all
https://www.maukerja.my/job/26269077-part-time-pastry-decorator-assistant,26269077,Part-Time Pastry Decorator Assistant,Wish You Good Sdn Bhd,MYR10 - MYR12 Sejam,Separuh Masa,"Setapak, WP Kuala Lumpur",MYR10 - MYR12 Sejam,6 hours ago,"Pastry, decoration",part-time-all
https://www.maukerja.my/job/26269064-part-time-baker-pastry-assistant-decoration,26269064,Part-Time Baker/ Pastry Assistant (Decoration),Wish You Good Sdn Bhd,MYR10 - MYR12 Sejam,Separuh Masa,"Setapak, WP Kuala Lumpur",MYR10 - MYR12 Sejam,6 hours ago,"Pastry, decoration",part-time-all
https://www.maukerja.my/job/26269079-part-time-cake-decorator-assistant,26269079,Part-Time Cake Decorator Assistant,Wish You Good Sdn Bhd,MYR10 - MYR12 Sejam,Separuh Masa,"Setapak, WP Kuala Lumpur",MYR10 - MYR12 Sejam,6 hours ago,"Pastry, decoration",part-time-all
https://www.maukerja.my/job/26269078-part-time-bakery-decoration-assistant,26269078,Part-Time Bakery Decoration Assistant,Wish You Good Sdn Bhd,MYR10 - MYR12 Sejam,Separuh Masa,"Setapak, WP Kuala Lumpur",MYR10 - MYR12 Sejam,6 hours ago,"Pastry, decoration",part-time-all
https://www.maukerja.my/job/26268359-perunding-takaful,26268359,Perunding Takaful,GT 3 SOLUTION,Undisclosed,Separuh Masa,"Johor Bahru, Johor",Undisclosed,10 hours ago,"Any Skills, Sales Strategy",part-time-all
https://www.maukerja.my/job/26268360-part-time-sales-and-marketing-specialist,26268360,Part-Time Sales and Marketing Specialist,GT 3 SOLUTION,Undisclosed,Separuh Masa,"Johor Bahru, Johor",Undisclosed,10 hours ago,"Any Skills, Sales Strategy",part-time-all
https://www.maukerja.my/job/26269045-doktor-locum,26269045,Doktor Locum,Wellness Lab,MYR50 - MYR80 Sejam,Separuh Masa,"Johor Bahru, Johor",MYR50 - MYR80 Sejam,6 hours ago,"Sonographer, Sonography",part-time-all
https://www.maukerja.my/job/26269046-part-time-general-practitioner,26269046,Part-Time General Practitioner,Wellness Lab,MYR50 - MYR80 Per Hour,Part Time,"Johor Bahru, Johor",MYR50 - MYR80 Per Hour,6 hours ago,"Sonographer, Sonography",part-time-all
https://www.maukerja.my/job/26269044-part-time-creative-specialist,26269044,Part-Time Creative Specialist,C.I.S Network Sdn Bhd,"MYR2,000 - MYR4,500 monthly",Part Time,WP Kuala Lumpur,"MYR2,000 - MYR4,500 monthly",6 hours ago,"Graphic Design, Content Creation",part-time-all
https://www.maukerja.my/job/26267282-part-time-pet-fair-event-promoter-pet-expo-malaysia,26267282,Part-Time Pet Fair Event Promoter (PET EXPO MALAYSIA),Noble Paws Sdn. Bhd.,MYR120 - MYR180 Per Day,Part Time,"Seri Kembangan, Selangor",MYR120 - MYR180 Per Day,13 hours ago,"Event Promotion, Marketing",part-time-all
https://www.maukerja.my/job/26248027-part-time-trademarks-department,26248027,Part-Time Trademarks Department,DCC Advanz Malaysia Sdn Bhd,MYR64 - MYR80 Per Day,Part Time,"Petaling Jaya, Selangor",MYR64 - MYR80 Per Day,14 hours ago,"Communication, Organisation",part-time-all
https://www.maukerja.my/job/14520655-crew-member-part-time-dominos-pizza-sungai-besar,14520655,Crew Member (Part Time) ( Domino’s Pizza Sungai Besar ),Domino's Pizza,Up to MYR8.72 Per Hour,N/A,"Sungai Besar, Selangor",Up to MYR8.72 Per Hour,a month ago,Any Skill,part-time-all
https://www.maukerja.my/job/15678045-crew-member-full-time-dominos-pizza-riverson,15678045,Crew Member (Full Time) ( Domino's Pizza Riverson ),Domino's Pizza,"Up to MYR1,700 Per Month",N/A,"Kota Kinabalu, Sabah","Up to MYR1,700 Per Month",a month ago,Any Skill,part-time-all
https://www.maukerja.my/job/15678293-crew-member-part-time-dominos-pizza-batu-caves,15678293,Crew Member (Part Time) ( Domino's Pizza Batu Caves ),Domino's Pizza,Up to MYR8.72 Sejam,N/A,"Batu Caves, Selangor",Up to MYR8.72 Sejam,a month ago,Any Skill,part-time-all
https://www.maukerja.my/job/14922250-crew-member-part-time-dominos-tawau,14922250,Crew Member (Part Time) ( Domino’s Tawau ),Domino's Pizza,Up to MYR8.72 Sejam,N/A,"Tawau, Sabah",Up to MYR8.72 Sejam,a month ago,Any Skill,part-time-all
https://www.maukerja.my/job/26265852-part-time-car-technician-wab-ac,26265852,Part-Time Car Technician (WAB/AC),Yorky Trading Sdn Bhd,"MYR2,000 - MYR3,000 Sebulan",Separuh Masa,"Petaling Jaya, Selangor","MYR2,000 - MYR3,000 Sebulan",15 hours ago,"Car Repair, Teamwork",part-time-all
https://www.maukerja.my/job/26267393-part-time-property-sales-consultant-training-provided,26267393,Part-Time Property Sales Consultant (Training Provided),Sooka Properties,"MYR2,000 - MYR8,000 Per Month",Part Time,"Subang Jaya, Selangor","MYR2,000 - MYR8,000 Per Month",13 hours ago,"Sales, Real Estate",part-time-all
https://www.maukerja.my/job/26254502-part-time-retail-associate-mango-pavilion-bukit-jalil,26254502,"Part-Time Retail Associate (Mango, Pavilion Bukit Jalil)",Mango,MYR8 - MYR10 Per Month,Part Time,WP Kuala Lumpur,MYR8 - MYR10 Per Month,14 hours ago,"Customer Service, Communication",part-time-all
https://www.maukerja.my/job/26248029-part-time-intellectual-property-assistant,26248029,Part-Time Intellectual Property Assistant,DCC Advanz Malaysia Sdn Bhd,MYR64 - MYR80 Per Day,Part Time,"Petaling Jaya, Selangor",MYR64 - MYR80 Per Day,3 days ago,"Communication, Organisation",part-time-all
https://www.maukerja.my/job/26248028-part-time-trademark-paralegal,26248028,Part-Time Trademark Paralegal,DCC Advanz Malaysia Sdn Bhd,MYR64 - MYR80 Per Day,Part Time,"Petaling Jaya, Selangor",MYR64 - MYR80 Per Day,3 days ago,"Communication, Organisation",part-time-all
https://www.maukerja.my/job/26248032-part-time-trademark-coordinator,26248032,Part-Time Trademark Coordinator,DCC Advanz Malaysia Sdn Bhd,MYR64 - MYR80 Per Day,Part Time,"Petaling Jaya, Selangor",MYR64 - MYR80 Per Day,3 days ago,"Communication, Organisation",part-time-all
https://www.maukerja.my/job/26248031-part-time-ip-paralegal,26248031,Part-Time IP Paralegal,DCC Advanz Malaysia Sdn Bhd,MYR64 - MYR80 Per Day,Part Time,"Petaling Jaya, Selangor",MYR64 - MYR80 Per Day,3 days ago,"Communication, Organisation",part-time-all
https://www.maukerja.my/job/26248030-part-time-legal-administrator-trademarks,26248030,Part-Time Legal Administrator - Trademarks,DCC Advanz Malaysia Sdn Bhd,MYR64 - MYR80 Per Day,Part Time,"Petaling Jaya, Selangor",MYR64 - MYR80 Per Day,3 days ago,"Communication, Organisation",part-time-all
https://www.maukerja.my/job/26259698-part-time-hr-and-accounts-administrator,26259698,Part-Time HR and Accounts Administrator,Origins Food Industries Sdn Bhd,"MYR2,500 - MYR3,000 Per Month",Part Time,"Bukit Mertajam, Pulau Pinang","MYR2,500 - MYR3,000 Per Month",a day ago,"Human Resources Management, Accounting",part-time-all
https://www.maukerja.my/job/26259662-pentadbir-sumber-manusia-akaun-jawatan-junior,26259662,Pentadbir Sumber Manusia Akaun (Jawatan Junior),Origins Food Industries Sdn Bhd,"MYR2,500 - MYR3,000 Per Month",Part Time,"Bukit Mertajam, Pulau Pinang","MYR2,500 - MYR3,000 Per Month",a day ago,"Human Resources Management, Accounting",part-time-all
https://www.maukerja.my/job/26248772-part-time-product-demonstrator,26248772,Part-Time Product Demonstrator,Trendy Brand Hub Sdn. Bhd.,MYR100 - MYR120 Per Day,Part Time,"Balakong, Selangor",MYR100 - MYR120 Per Day,2 days ago,Communication,part-time-all
https://www.maukerja.my/job/26248771-part-time-promoter,26248771,Part-Time Promoter,Trendy Brand Hub Sdn. Bhd.,MYR100 - MYR120 Per Day,Part Time,"Balakong, Selangor",MYR100 - MYR120 Per Day,2 days ago,Communication,part-time-all
https://www.maukerja.my/job/26248079-part-time-luxury-sales-assistant-part-time-mitsui-outlet,26248079,Part-Time Luxury Sales Assistant (Part Time) | Mitsui Outlet,Agensi Pekerjaan Cornerstone Global Partners (Malaysia) Sdn Bhd,MYR12 - MYR13 Per Hour,Part Time,Selangor,MYR12 - MYR13 Per Hour,2 days ago,"friendly, presentable",part-time-all
https://www.maukerja.my/job/26250374-part-time-barista,26250374,Part-Time Barista,Ticco Success Sdn Bhd,MYR40 - MYR80 Per Day,Part Time,"Subang Jaya, Selangor",MYR40 - MYR80 Per Day,2 days ago,"coffee machine, teamwork",part-time-all
https://www.maukerja.my/job/26257301-part-time-stock-controller,26257301,Part-Time Stock Controller,Pangu Sdn Bhd,"MYR2,500 - MYR2,700 Per Month",Part Time,"Batu, WP Kuala Lumpur","MYR2,500 - MYR2,700 Per Month",a day ago,"packing stock, organize stock",part-time-all
https://www.maukerja.my/job/26257299-part-time-warehouse-associate,26257299,Part-Time Warehouse Associate,Pangu Sdn Bhd,"MYR2,500 - MYR2,700 Per Month",Part Time,"Batu, WP Kuala Lumpur","MYR2,500 - MYR2,700 Per Month",a day ago,"packing stock, organize stock",part-time-all
https://www.maukerja.my/job/26257300-part-time-inventory-clerk,26257300,Part-Time Inventory Clerk,Pangu Sdn Bhd,"MYR2,500 - MYR2,700 Per Month",Part Time,"Batu, WP Kuala Lumpur","MYR2,500 - MYR2,700 Per Month",a day ago,"packing stock, organize stock",part-time-all
https://www.maukerja.my/job/26255949-business-operation-coordinator,26255949,Business Operation Coordinator,Cadvision Systems Sdn Bhd,"MYR1,000 - MYR2,500 Per Month",Part Time,"Bukit Mertajam, Pulau Pinang","MYR1,000 - MYR2,500 Per Month",a day ago,"Communication, Interpersonal",part-time-all
https://www.maukerja.my/job/26249161-part-time-personal-assistant,26249161,Part-Time Personal Assistant,Yew Sow Wah,"MYR2,500 - MYR3,500 Per Month",Part Time,WP Kuala Lumpur,"MYR2,500 - MYR3,500 Per Month",a day ago,"PC Skill, Designing",part-time-all
https://www.maukerja.my/job/26247669-ejen-takaful,26247669,Ejen Takaful,Ikhwan PJ Agency,"MYR2,000 - MYR5,000 monthly",Part Time,"Puchong, Selangor","MYR2,000 - MYR5,000 monthly",3 days ago,"Financial Management, Takaful Advisor",part-time-all
https://www.maukerja.my/job/26257297-part-time-storekeeper,26257297,Part-Time Storekeeper,Pangu Sdn Bhd,"MYR2,500 - MYR2,700 Per Month",Part Time,"Batu, WP Kuala Lumpur","MYR2,500 - MYR2,700 Per Month",a day ago,"packing stock, organize stock",part-time-all
https://www.maukerja.my/job/26211862-part-time-restaurant-staff,26211862,Part-Time Restaurant Staff,KBN Beef Noodle Sdn Bhd,MYR8 - MYR15 Per Hour,Part Time,"Petaling Jaya, Selangor",MYR8 - MYR15 Per Hour,7 days ago,"Order Taking, Communication",part-time-all
https://www.maukerja.my/job/26211159-part-time-live-streaming-assistant,26211159,Part-Time Live Streaming Assistant,New Sea Technology Sdn Bhd,"MYR2,000 - MYR5,000 daily",Part Time,WP Kuala Lumpur,"MYR2,000 - MYR5,000 daily",8 days ago,"Communication, Sales experience",part-time-all
https://www.maukerja.my/job/26185734-part-time-beautician,26185734,Part-Time Beautician,Advance Technical Solutions (M) Sdn Bhd,"MYR1,800 - MYR3,000 Per Day",Part Time,"Puchong, Selangor","MYR1,800 - MYR3,000 Per Day",10 days ago,"Facial, Communication",part-time-all
https://www.maukerja.my/job/26211188-part-time-digital-event-assistant,26211188,Part-Time Digital Event Assistant,New Sea Technology Sdn Bhd,"MYR2,000 - MYR5,000 daily",Part Time,WP Kuala Lumpur,"MYR2,000 - MYR5,000 daily",8 days ago,"Communication, Sales experience",part-time-all
https://www.maukerja.my/job/26211187-part-time-broadcast-support-specialist,26211187,Part-Time Broadcast Support Specialist,New Sea Technology Sdn Bhd,"MYR2,000 - MYR5,000 daily",Part Time,WP Kuala Lumpur,"MYR2,000 - MYR5,000 daily",8 days ago,"Communication, Sales experience",part-time-all
https://www.maukerja.my/job/26211186-part-time-live-content-coordinator,26211186,Part-Time Live Content Coordinator,New Sea Technology Sdn Bhd,"MYR2,000 - MYR5,000 daily",Part Time,WP Kuala Lumpur,"MYR2,000 - MYR5,000 daily",8 days ago,"Communication, Sales experience",part-time-all
https://www.maukerja.my/job/26211189-part-time-streaming-platform-associate,26211189,Part-Time Streaming Platform Associate,New Sea Technology Sdn Bhd,"MYR2,000 - MYR5,000 daily",Part Time,WP Kuala Lumpur,"MYR2,000 - MYR5,000 daily",8 days ago,"Communication, Sales experience",part-time-all
https://www.maukerja.my/job/26185736-part-time-beauty-therapist,26185736,Part-Time Beauty Therapist,Advance Technical Solutions (M) Sdn Bhd,"MYR1,800 - MYR3,000 Per Day",Part Time,"Puchong, Selangor","MYR1,800 - MYR3,000 Per Day",11 days ago,"Facial, Communication",part-time-all
https://www.maukerja.my/job/26195739-part-time-retail-assistant,26195739,Part-Time Retail Assistant,Cayland Momentum Sdn Bhd,"MYR1,700 - MYR3,000 Per Month",Part Time,WP Kuala Lumpur,"MYR1,700 - MYR3,000 Per Month",5 hours ago,"Customer Service, Customer Support",part-time-all
https://www.maukerja.my/job/26211190-part-time-online-production-assistant,26211190,Part-Time Online Production Assistant,New Sea Technology Sdn Bhd,"MYR2,000 - MYR5,000 daily",Part Time,WP Kuala Lumpur,"MYR2,000 - MYR5,000 daily",8 days ago,"Communication, Sales experience",part-time-all
https://www.maukerja.my/job/26185735-part-time-esthetician,26185735,Part-Time Esthetician,Advance Technical Solutions (M) Sdn Bhd,"MYR1,800 - MYR3,000 Per Day",Part Time,"Puchong, Selangor","MYR1,800 - MYR3,000 Per Day",11 days ago,"Facial, Communication",part-time-all
https://www.maukerja.my/job/26185739-part-time-facialist,26185739,Part-Time Facialist,Advance Technical Solutions (M) Sdn Bhd,"MYR1,800 - MYR3,000 Per Day",Part Time,"Puchong, Selangor","MYR1,800 - MYR3,000 Per Day",11 days ago,"Facial, Communication",part-time-all
https://www.maukerja.my/job/26195294-pembantu-gudang,26195294,Pembantu Gudang,Lifework HR Services Sdn Bhd,MYR110 - MYR130 Per Day,Part Time,"Kapar, Selangor",MYR110 - MYR130 Per Day,9 days ago,"Order Picking, Warehouse Operations",part-time-all
https://www.maukerja.my/job/26185737-part-time-skincare-specialist,26185737,Part-Time Skincare Specialist,Advance Technical Solutions (M) Sdn Bhd,"MYR1,800 - MYR3,000 Per Day",Part Time,"Puchong, Selangor","MYR1,800 - MYR3,000 Per Day",11 days ago,"Facial, Communication",part-time-all
https://www.maukerja.my/job/26185738-part-time-cosmetologist,26185738,Part-Time Cosmetologist,Advance Technical Solutions (M) Sdn Bhd,"MYR1,800 - MYR3,000 Per Day",Part Time,"Puchong, Selangor","MYR1,800 - MYR3,000 Per Day",11 days ago,"Facial, Communication",part-time-all
https://www.maukerja.my/job/26123937-part-time-digital-marketing-executive,26123937,Part-Time Digital Marketing Executive,Dakar Trucks Solutions Sdn Bhd,MYR300 - MYR500 Per Week,Part Time,"Kapar, Selangor",MYR300 - MYR500 Per Week,17 days ago,"Social Media Marketing, Social Media Strategy",part-time-all
https://www.maukerja.my/job/26109087-company-secretary,26109087,Company Secretary,Sinnova Consulting Sdn Bhd,"MYR6,000 - MYR10,000 monthly","Full Time,",WP Kuala Lumpur,"MYR6,000 - MYR10,000 monthly",2 days ago,"Corporate Governance, Company Law",part-time-all
https://www.maukerja.my/job/26123959-part-time-digital-marketing-specialist,26123959,Part-Time Digital Marketing Specialist,Dakar Trucks Solutions Sdn Bhd,MYR300 - MYR500 Per Week,Part Time,"Kapar, Selangor",MYR300 - MYR500 Per Week,17 days ago,"Social Media Marketing, Social Media Strategy",part-time-all
https://www.maukerja.my/job/26123955-part-time-digital-marketing-specialist,26123955,Part-Time Digital Marketing Specialist,Dakar Trucks Solutions Sdn Bhd,MYR300 - MYR500 Per Week,Part Time,"Kapar, Selangor",MYR300 - MYR500 Per Week,17 days ago,"Social Media Marketing, Social Media Strategy",part-time-all
https://www.maukerja.my/job/26123951-part-time-digital-marketing-specialist,26123951,Part-Time Digital Marketing Specialist,Dakar Trucks Solutions Sdn Bhd,MYR300 - MYR500 Per Week,Part Time,"Kapar, Selangor",MYR300 - MYR500 Per Week,17 days ago,"Social Media Marketing, Social Media Strategy",part-time-all
https://www.maukerja.my/job/26229379-part-time-crew-rm-950-hour-nandos-coalfields,26229379,Part Time Crew (RM 9.50/hour) ( Nando's Coalfields ),Nandos Chickenland Malaysia Sdn Bhd,Up to MYR9.50 Per Hour,N/A,"Sungai Buloh, Selangor",Up to MYR9.50 Per Hour,6 days ago,Any Skill,part-time-all
https://www.maukerja.my/job/26195336-part-time-storeman,26195336,Part-Time Storeman,Lifework HR Services Sdn Bhd,MYR110 - MYR130 Per Day,Part Time,"Kapar, Selangor",MYR110 - MYR130 Per Day,9 days ago,"Order Picking, Warehouse Operations",part-time-all
https://www.maukerja.my/job/26123961-part-time-marketing-associate,26123961,Part-Time Marketing Associate,Dakar Trucks Solutions Sdn Bhd,MYR300 - MYR500 Per Week,Part Time,"Kapar, Selangor",MYR300 - MYR500 Per Week,17 days ago,"Social Media Marketing, Social Media Strategy",part-time-all
https://www.maukerja.my/job/26123957-part-time-marketing-associate,26123957,Part-Time Marketing Associate,Dakar Trucks Solutions Sdn Bhd,MYR300 - MYR500 Per Week,Part Time,"Kapar, Selangor",MYR300 - MYR500 Per Week,17 days ago,"Social Media Marketing, Social Media Strategy",part-time-all
https://www.maukerja.my/job/26123953-part-time-marketing-associate,26123953,Part-Time Marketing Associate,Dakar Trucks Solutions Sdn Bhd,MYR300 - MYR500 Per Week,Part Time,"Kapar, Selangor",MYR300 - MYR500 Per Week,17 days ago,"Social Media Marketing, Social Media Strategy",part-time-all
https://www.maukerja.my/job/26196259-part-time-broadcast-host,26196259,Part-Time Broadcast Host,M3EC Millennium Sdn Bhd,MYR30 - MYR45 Per Hour,Part Time,"Cheras, Selangor",MYR30 - MYR45 Per Hour,9 days ago,"Live Streaming, Sales Techniques",part-time-all
https://www.maukerja.my/job/26196256-hos-siaran-langsung,26196256,Hos Siaran Langsung,M3EC Millennium Sdn Bhd,MYR30 - MYR45 Per Hour,Part Time,"Cheras, Selangor",MYR30 - MYR45 Per Hour,9 days ago,"Live Streaming, Sales Techniques",part-time-all
https://www.maukerja.my/job/26196258-part-time-livestream-presenter,26196258,Part-Time Livestream Presenter,M3EC Millennium Sdn Bhd,MYR30 - MYR45 Per Hour,Part Time,"Cheras, Selangor",MYR30 - MYR45 Per Hour,9 days ago,"Live Streaming, Sales Techniques",part-time-all
https://www.maukerja.my/job/26196249-part-time-promoter,26196249,Part-Time Promoter,Syarikat Nang Hin Trading Sdn Bhd,MYR130 - MYR131 Per Day,Part Time,"Puchong, Selangor",MYR130 - MYR131 Per Day,9 days ago,"Communication, Customer Service",part-time-all
https://www.maukerja.my/job/26195335-part-time-warehouse-assistant,26195335,Part-Time Warehouse Assistant,Lifework HR Services Sdn Bhd,MYR110 - MYR130 Per Day,Part Time,"Kapar, Selangor",MYR110 - MYR130 Per Day,9 days ago,"Order Picking, Warehouse Operations",part-time-all
https://www.maukerja.my/job/26123954-part-time-digital-marketing-analyst,26123954,Part-Time Digital Marketing Analyst,Dakar Trucks Solutions Sdn Bhd,MYR300 - MYR500 Per Week,Part Time,"Kapar, Selangor",MYR300 - MYR500 Per Week,17 days ago,"Social Media Marketing, Social Media Strategy",part-time-all
https://www.maukerja.my/job/26123962-part-time-digital-marketing-analyst,26123962,Part-Time Digital Marketing Analyst,Dakar Trucks Solutions Sdn Bhd,MYR300 - MYR500 Per Week,Part Time,"Kapar, Selangor",MYR300 - MYR500 Per Week,17 days ago,"Social Media Marketing, Social Media Strategy",part-time-all
https://www.maukerja.my/job/26123958-part-time-digital-marketing-analyst,26123958,Part-Time Digital Marketing Analyst,Dakar Trucks Solutions Sdn Bhd,MYR300 - MYR500 Per Week,Part Time,"Kapar, Selangor",MYR300 - MYR500 Per Week,17 days ago,"Social Media Marketing, Social Media Strategy",part-time-all
https://www.maukerja.my/job/26166185-part-time-digital-designer,26166185,Part-Time Digital Designer,YMF Tax Consultancy Sdn Bhd,Undisclosed,Part Time,"Puchong, Selangor",Undisclosed,13 days ago,"Graphic Design, Typography",part-time-all
https://www.maukerja.my/job/26166186-part-time-ui-designer,26166186,Part-Time UI Designer,YMF Tax Consultancy Sdn Bhd,Undisclosed,Part Time,"Puchong, Selangor",Undisclosed,13 days ago,"Graphic Design, Typography",part-time-all
https://www.maukerja.my/job/26166187-part-time-ux-ui-designer,26166187,Part-Time UX/UI Designer,YMF Tax Consultancy Sdn Bhd,Undisclosed,Part Time,"Puchong, Selangor",Undisclosed,13 days ago,"Graphic Design, Typography",part-time-all
https://www.maukerja.my/job/26187110-pembantu-bakeri,26187110,Pembantu Bakeri,Luxe Tiramisu Cafe,Undisclosed,Part Time,"Cheras, Selangor",Undisclosed,10 days ago,"Food safety and hygiene, Food preparation",part-time-all
https://www.maukerja.my/job/26228626-part-time-part-time-retail-associate-furla-nu-empire,26228626,"Part Time Part Time Retail Associate (Furla, Nu Empire",Furla,MYR9 - MYR10 Per Hour,Part Time,"Subang Jaya, Selangor",MYR9 - MYR10 Per Hour,3 days ago,"Customer Service, Sales",part-time-all
https://www.maukerja.my/job/26166184-part-time-visual-designer,26166184,Part-Time Visual Designer,YMF Tax Consultancy Sdn Bhd,Undisclosed,Part Time,"Puchong, Selangor",Undisclosed,13 days ago,"Graphic Design, Typography",part-time-all
https://www.maukerja.my/job/26123956-part-time-online-marketing-specialist,26123956,Part-Time Online Marketing Specialist,Dakar Trucks Solutions Sdn Bhd,MYR300 - MYR500 Per Week,Part Time,"Kapar, Selangor",MYR300 - MYR500 Per Week,17 days ago,"Social Media Marketing, Social Media Strategy",part-time-all
https://www.maukerja.my/job/26123952-part-time-online-marketing-specialist,26123952,Part-Time Online Marketing Specialist,Dakar Trucks Solutions Sdn Bhd,MYR300 - MYR500 Seminggu,Separuh Masa,"Kapar, Selangor",MYR300 - MYR500 Seminggu,17 days ago,"Social Media Marketing, Social Media Strategy",part-time-all
https://www.maukerja.my/job/26123960-part-time-online-marketing-specialist,26123960,Part-Time Online Marketing Specialist,Dakar Trucks Solutions Sdn Bhd,MYR300 - MYR500 Seminggu,Separuh Masa,"Kapar, Selangor",MYR300 - MYR500 Seminggu,17 days ago,"Social Media Marketing, Social Media Strategy",part-time-all
https://www.maukerja.my/job/26225711-pemandu-sambilan,26225711,Pemandu Sambilan,Malton Berhad,MYR80 - MYR90 Sehari,Separuh Masa,WP Kuala Lumpur,MYR80 - MYR90 Sehari,6 days ago,Driving,part-time-all
https://www.maukerja.my/job/26166146-part-time-creative-designer,26166146,Part-Time Creative Designer,YMF Tax Consultancy Sdn Bhd,Undisclosed,Separuh Masa,"Puchong, Selangor",Undisclosed,13 days ago,"Graphic Design, Typography",part-time-all
https://www.maukerja.my/job/26187584-part-time-service-crew,26187584,Part-Time Service Crew,The Precious Seed Management Sdn. Bhd. (Just Pets Megastore),MYR9.50 - MYR10 Sejam,Separuh Masa,"Petaling Jaya, Selangor",MYR9.50 - MYR10 Sejam,10 days ago,"Customer Service, Sales",part-time-all
https://www.maukerja.my/job/26157389-part-time-assistant-housekeeping-executive,26157389,Part-Time Assistant Housekeeping Executive,N/A,MYR18 - MYR25 hourly,Separuh Masa,"Batu, WP Kuala Lumpur",MYR18 - MYR25 hourly,14 days ago,"Housekeeping, Cleaning",part-time-all
https://www.maukerja.my/job/26245841-part-time-teacher,26245841,Part-Time Teacher,Excellent Tuition Centre Sdn. Bhd.,"MYR1,350 - MYR1,800 Sebulan",Separuh Masa,WP Kuala Lumpur,"MYR1,350 - MYR1,800 Sebulan",3 days ago,"Classroom Management, Lesson Planning",part-time-all
https://www.maukerja.my/job/26202934-part-time-delivery-rider,26202934,Part-Time (Delivery Rider),Owls Kitchen KL Sdn. Bhd.,MYR30 - MYR100 Sehari,Separuh Masa,WP Kuala Lumpur,MYR30 - MYR100 Sehari,8 days ago,"Riding, Navigation",part-time-all
https://www.maukerja.my/job/26206430-part-time-delivery-rider,26206430,Part-Time (Delivery Rider),Owls Kitchen KL Sdn. Bhd.,MYR30 - MYR100 Sehari,Separuh Masa,WP Kuala Lumpur,MYR30 - MYR100 Sehari,8 days ago,"Riding, Navigation",part-time-all
https://www.maukerja.my/job/26067963-part-time-restaurant-server,26067963,Part-Time Restaurant Server,About Concept Dining Sdn Bhd,MYR8 - MYR10 Sejam,Separuh Masa,"Iskandar Puteri, Johor",MYR8 - MYR10 Sejam,24 days ago,"Customer Service, Cashiering",part-time-all
https://www.maukerja.my/job/26067958-part-time-restaurant-server,26067958,Part-Time Restaurant Server,About Concept Dining Sdn Bhd,MYR8 - MYR10 Sejam,Separuh Masa,"Iskandar Puteri, Johor",MYR8 - MYR10 Sejam,24 days ago,"Customer Service, Cashiering",part-time-all
https://www.maukerja.my/job/26067953-part-time-restaurant-server,26067953,Part-Time Restaurant Server,About Concept Dining Sdn Bhd,MYR8 - MYR10 Sejam,Separuh Masa,"Iskandar Puteri, Johor",MYR8 - MYR10 Sejam,24 days ago,"Customer Service, Cashiering",part-time-all
https://www.maukerja.my/job/26067966-part-time-waitress,26067966,Part-Time Waitress,About Concept Dining Sdn Bhd,MYR8 - MYR10 Sejam,Separuh Masa,"Iskandar Puteri, Johor",MYR8 - MYR10 Sejam,24 days ago,"Customer Service, Cashiering",part-time-all
