url,job_id,title,company,salary,job_type,location,date_posted,skills,source_combo
N/A,N/A,N/A,N/A,N/A,N/A,N/A,N/A,N/A,internship-johor
https://www.maukerja.my/job/26443716-internship-for-eksekutif-pembangunan-perniagaan,26443716,Internship For Eksekutif Pembangunan Perniagaan,NMIT Resources Sdn Bhd,"MYR500 - MYR1,500 Sebulan",Latihan Industri,"Johor Bahru, Johor",8 hours ago,"Communication, Presentation",internship-johor
https://www.maukerja.my/job/26441417-internship-for-data-centre-assistant,26441417,Internship For Data Centre Assistant,Agensi Pekerjaan XGiants Consulting Malaysia Sdn. Bhd.,"MYR3,000 - MYR4,500 Sebulan",Latihan Industri,"Johor Bahru, Johor",11 hours ago,"PLC, Electrical Engineering",internship-johor
https://www.maukerja.my/job/26315766-internship-for-top-sales-kedai-emas,26315766,Internship For Top Sales Kedai Emas,Cantik Gold Sdn Bhd,"MYR500 - MYR1,000 Sebulan",Latihan Industri,"Masai, Johor",8 hours ago,"Sales Techniques, TikTok",internship-johor
https://www.maukerja.my/job/26428999-internship-for-audit,26428999,Internship For Audit,KC & Partners Plt,"MYR1,000 - MYR1,500 Sebulan",Latihan Industri,"Ulu Tiram, Johor",a day ago,"Auditing, Financial Reporting",internship-johor
https://www.maukerja.my/job/26428981-internship-for-account,26428981,Internship For Account,Wei Kwang Electrical & Air-cond Engineering Works,MYR600 - MYR800 Sebulan,Latihan Industri,"Johor Bahru, Johor",a day ago,"Data Entry, Microsoft Office",internship-johor
https://www.maukerja.my/job/26428983-internship-for-admin,26428983,Internship For Admin,Wei Kwang Electrical & Air-cond Engineering Works,MYR600 - MYR800 Sebulan,Latihan Industri,"Johor Bahru, Johor",a day ago,"Data Entry, Microsoft Office",internship-johor
https://www.maukerja.my/job/26404857-internship-in-accounts,26404857,Internship in Accounts,I K Management,MYR500 - MYR700 Sebulan,Latihan Industri,Johor,4 days ago,"Accounting Principles, Bookkeeping",internship-johor
https://www.maukerja.my/job/26428940-internship-for-for-business-development-marketing-intern,26428940,Internship For for Business Development / Marketing Intern,Smartpeep Sdn Bhd,MYR500 - MYR700 Sebulan,Latihan Industri,"Masai, Johor",a day ago,Digital Marketing,internship-johor
https://www.maukerja.my/job/26383117-internship-for-dental-assistant,26383117,Internship For Dental Assistant,Klinik Pergigian V-Smile,"MYR1,800 - MYR2,200 Sebulan",Latihan Industri,"Gelang Patah, Johor",7 days ago,"Chairside assisting, Receptionist",internship-johor
https://www.maukerja.my/job/26353986-internship-for-account-associate,26353986,Internship For Account Associate,SY Poh & Co,"MYR1,000 - MYR1,200 Sebulan",Latihan Industri,"Johor Bahru, Johor",9 days ago,"Accounting, Auditing",internship-johor
https://www.maukerja.my/job/26398498-internship-for-culinary-assistant,26398498,Internship For Culinary Assistant,Aftertaste Food Enterprise Sdn Bhd,"MYR1,200 - MYR1,600 Sebulan",Latihan Industri,"Kluang, Johor",5 days ago,Culinary,internship-johor
https://www.maukerja.my/job/26348999-internship-for-mechanical-electrical,26348999,Internship For Mechanical / Electrical,Sinetek Engineering Sdn. Bhd.,Up to MYR600 Sebulan,Latihan Industri,"Johor Bahru, Johor",10 days ago,"Mechanical Engineering, Electrical Engineering",internship-johor
https://www.maukerja.my/job/26311813-internship-for-admin,26311813,Internship For Admin,Country Garden Pacificview Sdn Bhd,"MYR900 - MYR1,000 Sebulan",Latihan Industri,"Gelang Patah, Johor",11 days ago,"Administrative Support, Customer Service",internship-johor
https://www.maukerja.my/job/26363265-internship-for-quantity-surveyor,26363265,Internship For Quantity Surveyor,Woon Brothers Construction Sdn. Bhd.,Undisclosed,Latihan Industri,"Johor Bahru, Johor",9 days ago,"Quantity Take-off, Cost Estimation",internship-johor
https://www.maukerja.my/job/26351506-internship-for-internship-welcome,26351506,Internship For Internship Welcome!,Cadvision Systems Sdn Bhd,"MYR800 - MYR1,000 Sebulan",Latihan Industri,"Johor Bahru, Johor",9 days ago,"Communication, Learning and Development",internship-johor
https://www.maukerja.my/job/26270771-internship-for-account,26270771,Internship For Account,Country Garden Pacificview Sdn Bhd,"MYR900 - MYR1,000 Sebulan",Latihan Industri,"Gelang Patah, Johor",13 days ago,Account Management,internship-johor
https://www.maukerja.my/job/26426227-internship-for-software-developer,26426227,Internship For Software Developer,Smartpeep Sdn Bhd,MYR500 - MYR700 Sebulan,"Latihan Industri,","Masai, Johor",2 days ago,Coding,internship-johor
https://www.maukerja.my/job/26116747-human-resources-live-streaming-operations-intern,26116747,Human Resources & Live Streaming Operations Intern,Blaze Official,"MYR1,200 - MYR1,600 Sebulan",Latihan Industri,"Iskandar Puteri, Johor",8 hours ago,"Communication, Interest in Human Resources and/or live streaming industry",internship-johor
https://www.maukerja.my/job/26245862-internship-for-interior-designer,26245862,Internship For Interior Designer,Nuspace Infra and Build Sdn Bhd,"MYR800 - MYR2,000 Sebulan",Latihan Industri,"Iskandar Puteri, Johor",17 days ago,"Interior Design, Project Management",internship-johor
https://www.maukerja.my/job/26314329-internship-for-it-asset-support,26314329,Internship For IT Asset Support,Integrated System Itech Sdn Bhd,"MYR500 - MYR2,000 Sebulan",Latihan Industri,"Kulai, Johor",11 days ago,"Asset Management, Computer Hardware",internship-johor
https://www.maukerja.my/job/26135041-internship-for-account-clerk,26135041,Internship For Account Clerk,Casso M Sdn Bhd,"MYR1,000 - MYR1,700 Sebulan",Latihan Industri,Johor,a month ago,"Data Entry, Bookkeeping",internship-johor
https://www.maukerja.my/job/26087636-internship-for-accounts-assistant,26087636,Internship For Accounts Assistant,I K Management,MYR500 - MYR700 Sebulan,Latihan Industri,Johor,a month ago,"Accounting, Bookkeeping",internship-johor
https://www.maukerja.my/job/26087633-internship-for-accounts,26087633,Internship For Accounts,I K Management,MYR500 - MYR700 Sebulan,Latihan Industri,Johor,a month ago,"Accounting, Bookkeeping",internship-johor
https://www.maukerja.my/job/26087637-internship-for-accounts-assistant,26087637,Internship For Accounts Assistant,I K Management,MYR500 - MYR700 Sebulan,Latihan Industri,Johor,a month ago,"Accounting, Bookkeeping",internship-johor
https://www.maukerja.my/job/26087635-internship-for-accounts-assistant,26087635,Internship For Accounts Assistant,I K Management,MYR500 - MYR700 Sebulan,Latihan Industri,Johor,a month ago,"Accounting, Bookkeeping",internship-johor
https://www.maukerja.my/job/26118868-pelatih-jualan-pembangunan-perniagaan,26118868,Pelatih Jualan / Pembangunan Perniagaan,Toys Park Marketing,"MYR400 - MYR1,000 Sebulan",Latihan Industri,"Johor Bahru, Johor",an hour ago,"Social Media Marketing, Sales Strategy",internship-johor
https://www.maukerja.my/job/26024810-internship-for-account-assistant,26024810,Internship For Account Assistant,Y&Y Consulting Group Sdn Bhd,"MYR500 - MYR1,500 Sebulan",Latihan Industri,Johor,a month ago,"Communication, Problem-Solving",internship-johor
https://www.maukerja.my/job/26024811-internship-for-account-executive,26024811,Internship For Account Executive,Y&Y Consulting Group Sdn Bhd,"MYR500 - MYR1,500 Sebulan",Latihan Industri,Johor,a month ago,"Communication, Problem-Solving",internship-johor
https://www.maukerja.my/job/26024805-internship-for-account-assistant,26024805,Internship For Account Assistant,Y&Y Consulting Group Sdn Bhd,"MYR500 - MYR1,500 Sebulan",Latihan Industri,Johor,a month ago,"Communication, Problem-Solving",internship-johor
https://www.maukerja.my/job/26024801-internship-for-account-executive,26024801,Internship For Account Executive,Y&Y Consulting Group Sdn Bhd,"MYR500 - MYR1,500 Sebulan",Latihan Industri,Johor,a month ago,"Communication, Problem-Solving",internship-johor
N/A,N/A,N/A,N/A,N/A,N/A,N/A,N/A,N/A,internship-johor
https://www.maukerja.my/job/26024800-internship-for-account-assistant,26024800,Internship For Account Assistant,Y&Y Consulting Group Sdn Bhd,"MYR500 - MYR1,500 Sebulan",Latihan Industri,Johor,a month ago,"Communication, Problem-Solving",internship-johor
https://www.maukerja.my/job/26024799-internship-for-account,26024799,Internship For Account,Y&Y Consulting Group Sdn Bhd,"MYR500 - MYR1,500 Sebulan",Latihan Industri,Johor,a month ago,"Communication, Problem-Solving",internship-johor
https://www.maukerja.my/job/26024812-internship-for-accounts-receivable-account-assistant,26024812,Internship For Accounts Receivable Account Assistant,Y&Y Consulting Group Sdn Bhd,"MYR500 - MYR1,500 Sebulan",Latihan Industri,Johor,a month ago,"Communication, Problem-Solving",internship-johor
https://www.maukerja.my/job/26024814-internship-for-accounts-receivable-account-executive,26024814,Internship For Accounts Receivable Account Executive,Y&Y Consulting Group Sdn Bhd,"MYR500 - MYR1,500 Sebulan",Latihan Industri,Johor,a month ago,"Communication, Problem-Solving",internship-johor
https://www.maukerja.my/job/26024813-internship-for-accounts-payable-account-assistant,26024813,Internship For Accounts Payable Account Assistant,Y&Y Consulting Group Sdn Bhd,"MYR500 - MYR1,500 Sebulan",Latihan Industri,Johor,a month ago,"Communication, Problem-Solving",internship-johor
https://www.maukerja.my/job/26024809-internship-for-accounts-receivable-account-executive,26024809,Internship For Accounts Receivable Account Executive,Y&Y Consulting Group Sdn Bhd,"MYR500 - MYR1,500 Sebulan",Latihan Industri,Johor,a month ago,"Communication, Problem-Solving",internship-johor
https://www.maukerja.my/job/25992330-internship-for-marketing-executive,25992330,Internship For Marketing Executive,Advance Genesis Equipment (South) Sdn Bhd,"MYR500 - MYR1,000 Sebulan",Latihan Industri,"Iskandar Puteri, Johor",a month ago,"Marketing Strategy, Content Creation",internship-johor
https://www.maukerja.my/job/26053971-internship-for-digital-marketing-coordinator,26053971,Internship For Digital Marketing Coordinator,MYK Malaysia Sdn Bhd,"Up to MYR1,000 Sebulan",Latihan Industri,"Iskandar Puteri, Johor",a month ago,"Creative, time-management skills",internship-johor
https://www.maukerja.my/job/26053973-internship-for-digital-marketing-coordinator,26053973,Internship For Digital Marketing Coordinator,MYK Malaysia Sdn Bhd,"Up to MYR1,000 Sebulan",Latihan Industri,"Iskandar Puteri, Johor",a month ago,"Creative, time-management skills",internship-johor
https://www.maukerja.my/job/26053972-internship-for-digital-marketing-coordinator,26053972,Internship For Digital Marketing Coordinator,MYK Malaysia Sdn Bhd,"Up to MYR1,000 Sebulan",Latihan Industri,"Iskandar Puteri, Johor",a month ago,"Creative, time-management skills",internship-johor
https://www.maukerja.my/job/25923858-internship-for-marketing-content-creation,25923858,Internship For Marketing & Content Creation,Good Life Real Estate Sdn Bhd,"MYR800 - MYR1,000 Sebulan",Latihan Industri,"Johor Bahru, Johor",12 hours ago,"Content Creation, Marketing Strategy",internship-johor
https://www.maukerja.my/job/26024804-internship-for-accounts-receivable-account-executive,26024804,Internship For Accounts Receivable Account Executive,Y&Y Consulting Group Sdn Bhd,"MYR500 - MYR1,500 Sebulan",Latihan Industri,Johor,a month ago,"Communication, Problem-Solving",internship-johor
https://www.maukerja.my/job/26024808-internship-for-accounts-payable-account-assistant,26024808,Internship For Accounts Payable Account Assistant,Y&Y Consulting Group Sdn Bhd,"MYR500 - MYR1,500 Sebulan",Latihan Industri,Johor,a month ago,"Communication, Problem-Solving",internship-johor
https://www.maukerja.my/job/26024807-internship-for-accounts-receivable-account-assistant,26024807,Internship For Accounts Receivable Account Assistant,Y&Y Consulting Group Sdn Bhd,"MYR500 - MYR1,500 Sebulan",Latihan Industri,Johor,a month ago,"Communication, Problem-Solving",internship-johor
https://www.maukerja.my/job/26024806-internship-for-account-executive,26024806,Internship For Account Executive,Y&Y Consulting Group Sdn Bhd,"MYR500 - MYR1,500 Sebulan",Latihan Industri,Johor,a month ago,"Communication, Problem-Solving",internship-johor
https://www.maukerja.my/job/25902448-internship-for-accounts-intern,25902448,Internship For Accounts Intern,Seng Li Marketing Sdn Bhd,"MYR800 - MYR1,200 Sebulan",Latihan Industri,Johor,a month ago,Basic accounting concepts,internship-johor
https://www.maukerja.my/job/26024803-internship-for-accounts-payable-account-assistant,26024803,Internship For Accounts Payable Account Assistant,Y&Y Consulting Group Sdn Bhd,"MYR500 - MYR1,500 Sebulan",Latihan Industri,Johor,a month ago,"Communication, Problem-Solving",internship-johor
https://www.maukerja.my/job/26024802-internship-for-accounts-receivable-account-assistant,26024802,Internship For Accounts Receivable Account Assistant,Y&Y Consulting Group Sdn Bhd,"MYR500 - MYR1,500 Sebulan",Latihan Industri,Johor,a month ago,"Communication, Problem-Solving",internship-johor
https://www.maukerja.my/job/26213499-pereka-grafik-latihan-industri,26213499,Pereka Grafik (Latihan Industri),SOHO Labs Sdn Bhd,"MYR500 - MYR3,000 Sebulan",Latihan Industri,"Johor Bahru, Johor",21 days ago,"Graphic Design, Adobe Creative Suite",internship-johor
https://www.maukerja.my/job/26068050-internship-for-social-media-marketing-design,26068050,Internship For Social Media Marketing & Design,Lang International Corporate Titan Awards (LICTA),"Up to MYR1,500 Sebulan",Latihan Industri,"Masai, Johor",a month ago,"Social Media Marketing, Graphic Design",internship-johor
https://www.maukerja.my/job/25935147-internship-for-audit-account,25935147,Internship For Audit/ Account,Soon Business Solutions Sdn Bhd,"MYR800 - MYR1,200 Sebulan",Latihan Industri,Johor,10 days ago,"Auditing, Financial Accounting",internship-johor
https://www.maukerja.my/job/26106718-internship-for-automotive-service,26106718,Internship For Automotive Service,Gagner Auto Sdn Bhd,Undisclosed,Latihan Industri,"Johor Bahru, Johor",9 days ago,"Automotive, Internship for service side",internship-johor
https://www.maukerja.my/job/25923911-internship-for-finance-administration,25923911,Internship For Finance & Administration,Good Life Real Estate Sdn Bhd,"MYR800 - MYR1,000 Sebulan",Latihan Industri,"Johor Bahru, Johor",12 hours ago,"Financial Management, Accounting",internship-johor
https://www.maukerja.my/job/26124548-pembantu-cukai,26124548,Pembantu Cukai,SC & Associates Plt,"MYR1,700 - MYR4,000 Sebulan",Latihan Industri,"Muar, Johor",2 days ago,"Tax Law Knowledge, Microsoft Excel",internship-johor
https://www.maukerja.my/job/26124554-pembantu-cukai,26124554,Pembantu Cukai,SC & Associates Plt,"MYR1,700 - MYR4,000 Sebulan",Latihan Industri,"Muar, Johor",2 days ago,"Tax Law Knowledge, Microsoft Excel",internship-johor
https://www.maukerja.my/job/26068046-internship-for-admin,26068046,Internship For Admin,Lang International Corporate Titan Awards (LICTA),"Up to MYR1,500 Sebulan",Latihan Industri,"Masai, Johor",a month ago,"Administrative Support, Office Management",internship-johor
https://www.maukerja.my/job/25923828-internship-for-interior-design-project-support,25923828,Internship For Interior Design & Project Support,Good Life Real Estate Sdn Bhd,"MYR800 - MYR1,000 Sebulan",Latihan Industri,"Johor Bahru, Johor",12 hours ago,"Interior Design, Project Management",internship-johor
https://www.maukerja.my/job/26140530-internship-hr-international-business-business-admin-psychology-marketing,26140530,Internship (HR/International Business/Business Admin/Psychology/Marketing),Agensi Pekerjaan & Perundingcara Bright Prospect Sdn Bhd,"MYR1,000 - MYR1,200 Sebulan",Latihan Industri,"Johor Bahru, Johor",a month ago,communication skills,internship-johor
https://www.maukerja.my/job/26042761-pembantu-cukai,26042761,Pembantu Cukai,SC & Associates Plt,"MYR1,700 - MYR4,000 Sebulan",Latihan Industri,"Muar, Johor",2 days ago,"Tax Law Knowledge, Microsoft Excel",internship-johor
https://www.maukerja.my/job/26014420-internship-for-admin-clerk,26014420,Internship For Admin Clerk,Advance Genesis Equipment (South) Sdn Bhd,"MYR1,000 - MYR2,000 Sebulan",Latihan Industri,"Gelang Patah, Johor",a month ago,"Organization, Data Entry",internship-johor
N/A,N/A,N/A,N/A,N/A,N/A,N/A,N/A,N/A,internship-johor
https://www.maukerja.my/job/26042772-internship-for-accounting-clerk,26042772,Internship For Accounting Clerk,SC & Associates Plt,"MYR1,700 - MYR4,000 Sebulan",Latihan Industri,"Muar, Johor",a month ago,"Tax Law Knowledge, Microsoft Excel",internship-johor
https://www.maukerja.my/job/26042771-internship-for-accounting-clerk,26042771,Internship For Accounting Clerk,SC & Associates Plt,"MYR1,700 - MYR4,000 Sebulan",Latihan Industri,"Muar, Johor",a month ago,"Tax Law Knowledge, Microsoft Excel",internship-johor
https://www.maukerja.my/job/26042773-internship-for-accounting-clerk,26042773,Internship For Accounting Clerk,SC & Associates Plt,"MYR1,700 - MYR4,000 Sebulan",Latihan Industri,"Muar, Johor",a month ago,"Tax Law Knowledge, Microsoft Excel",internship-johor
https://www.maukerja.my/job/26144902-internship-for-administrative-and-it-software-support,26144902,Internship For Administrative and IT Software Support,"SQL, Autocount, Doctor Partner,Fav365, Fingertech","MYR700 - MYR1,200 Sebulan",Latihan Industri,"Johor Bahru, Johor",a month ago,"Cold Calling, Time Management",internship-johor
https://www.maukerja.my/job/26064311-internship-for-account,26064311,Internship For Account,Suzhou Terminal Operations Malaysia Sdn. Bhd.,"MYR1,000 - MYR1,800 Sebulan",Latihan Industri,"Pasir Gudang, Johor",a day ago,"Accounting, Financial Reporting",internship-johor
https://www.maukerja.my/job/25924125-guru-prasekolah,25924125,Guru Prasekolah,Eunoia Global Educare Sdn Bhd,"MYR1,600 - MYR2,000 Sebulan",Latihan Industri,Johor,a month ago,"Early Childhood Education, Classroom Management",internship-johor
https://www.maukerja.my/job/25924129-guru-prasekolah,25924129,Guru Prasekolah,Eunoia Global Educare Sdn Bhd,"MYR1,600 - MYR2,000 Sebulan",Latihan Industri,Johor,2 months ago,"Early Childhood Education, Classroom Management",internship-johor
https://www.maukerja.my/job/25958877-eksekutif-pentadbiran-latihan-praktikal,25958877,Eksekutif Pentadbiran (Latihan Praktikal),Pesco Pest Control Sdn Bhd,MYR600 - MYR800 Sebulan,Latihan Industri,"Johor Bahru, Johor",2 months ago,"Administrative Support, Scheduling",internship-johor
https://www.maukerja.my/job?jobId=26421658&slug=mechanical-internship-data-center-operations,N/A,Mechanical Internship: Data Center Operations,DayOne Data Centers Limited,Undisclosed,Latihan Industri,Johor Bahru,2 days ago,N/A,internship-johor
https://www.maukerja.my/job?jobId=26422758&slug=internship-event-assistant,N/A,Internship Event Assistant,Perk Idea Sdn Bhd,"MYR800 - MYR1,000 Sebulan",Latihan Industri,Senggarang,2 days ago,N/A,internship-johor
https://www.maukerja.my/job?jobId=26423006&slug=internship-clinic-assistant,N/A,Internship Clinic Assistant,Poliklinik Tan (Kulai),"MYR1,700 - MYR2,000 Sebulan",Latihan Industri,Kulai,2 days ago,N/A,internship-johor
https://www.maukerja.my/job?jobId=26432028&slug=graphic-design-internship,N/A,Graphic Design Internship,SHAPEE TRADING & DISTRIBUTION (M) SDN BHD,MYR700 - MYR700 Sebulan,"Latihan Industri,",Senai,a day ago,N/A,internship-johor
https://www.maukerja.my/job?jobId=26432062&slug=facility-intern,N/A,Facility Intern,STMicroelectronics,Undisclosed,Latihan Industri,Malaysia,a day ago,N/A,internship-johor
https://www.maukerja.my/job?jobId=26432070&slug=intern-facility-project,N/A,Intern-Facility Project,STMicroelectronics,Undisclosed,Latihan Industri,Malaysia,a day ago,N/A,internship-johor
https://www.maukerja.my/job?jobId=26432599&slug=r-d-internship,N/A,R-D Internship,Premium Vegetables Oils Sdn Bhd,"MYR1,000 - MYR1,000 Sebulan",Latihan Industri,Pasir Gudang,a day ago,N/A,internship-johor
https://www.maukerja.my/job?jobId=26432432&slug=internship-sales-immediate-intake,N/A,Internship - Sales (Immediate Intake),Country Garden Pacificview Sdn Bhd,"MYR1,000 - MYR1,000 Sebulan","Latihan Industri,",Gelang Patah,a day ago,N/A,internship-johor
https://www.maukerja.my/job?jobId=26432760&slug=internship-billing-account,N/A,Internship - Billing-Account,Tiong Nam Groups Of Companies,MYR900 - MYR900 Sebulan,Latihan Industri,Johor Bahru,a day ago,N/A,internship-johor
https://www.maukerja.my/job?jobId=26431715&slug=purchasing-and-logistic-internship,N/A,Purchasing and Logistic (Internship ),Laubros Holdings (M) Sdn Bhd,"MYR1,000 - MYR1,000 Sebulan","Latihan Industri,",Johor Bahru,a day ago,N/A,internship-johor
https://www.maukerja.my/job?jobId=26431718&slug=purchasing-and-logistic-internship,N/A,Purchasing and Logistic (Internship ),LAUBROS HOLDINGS (M) SDN BHD,"MYR1,000 - MYR1,000 Sebulan",Latihan Industri,Johor Bahru,a day ago,N/A,internship-johor
https://www.maukerja.my/job?jobId=26431713&slug=finance-operations-internship-may-june-intake,N/A,Finance Operations Internship - May - June Intake,Lapasar.com,"MYR800 - MYR1,000 Sebulan",Latihan Industri,Johor Bahru,a day ago,N/A,internship-johor
https://www.maukerja.my/job?jobId=26431716&slug=finance-operations-internship-may-june-intake,N/A,Finance Operations Internship - May - June Intake,Lapasar.Com,"MYR800 - MYR1,000 Sebulan",Latihan Industri,Johor Bahru,a day ago,N/A,internship-johor
https://www.maukerja.my/job?jobId=26431697&slug=hss-intern,N/A,HSS Intern,LEGOLAND Malaysia,MYR700 - MYR700 Sebulan,Latihan Industri,Gerbang Nusajaya,a day ago,N/A,internship-johor
https://www.maukerja.my/job?jobId=26431120&slug=marketing-internship-2026,N/A,MARKETING INTERNSHIP (2026),DOUBLE HAPPINESS ASIA FOODS (M) SDN BHD,MYR700 - MYR700 Sebulan,Latihan Industri,Johor Bahru,a day ago,N/A,internship-johor
https://www.maukerja.my/job?jobId=26432065&slug=facility-intern,N/A,Facility Intern,STMicroelectronics,Undisclosed,Latihan Industri,Malaysia,a day ago,N/A,internship-johor
https://www.maukerja.my/job?jobId=26432114&slug=internship-ehs-facility-student,N/A,INTERNSHIP - EHS - FACILITY STUDENT,TDK Electronics (Malaysia) Sdn. Bhd.,"MYR1,200 - MYR1,200 Sebulan",Latihan Industri,Johor Bahru,a day ago,N/A,internship-johor
https://www.maukerja.my/job?jobId=26432116&slug=internship-engineering-students,N/A,INTERNSHIP - ENGINEERING STUDENTS,TDK Electronics (Malaysia) Sdn. Bhd.,"MYR1,200 - MYR1,200 Sebulan",Latihan Industri,Johor Bahru,a day ago,N/A,internship-johor
https://www.maukerja.my/job?jobId=26432954&slug=digital-marketing-executive-sport-fashion-retailer-company-kuala-lumpur,N/A,Digital Marketing Executive - Sport Fashion Retailer Company - Kuala Lumpur,Polymorph Recruitment,Undisclosed,Latihan Industri,Skudai,a day ago,N/A,internship-johor
https://www.maukerja.my/job?jobId=26437900&slug=internship-quantity-surveyor-johor-bahru-batu-pahat,N/A,Internship Quantity Surveyor (Johor Bahru- Batu Pahat),Pamir Development Sdn Bhd,"MYR800 - MYR1,200 Sebulan",Latihan Industri,Johor Bahru,a day ago,N/A,internship-johor
https://www.maukerja.my/job?jobId=26437895&slug=internship-occupational-safety-and-health-osh,N/A,"Internship Occupational, Safety and Health (OSH)",Pamir Development Sdn Bhd,"MYR1,000 - MYR1,500 Sebulan",Latihan Industri,Johor Bahru,a day ago,N/A,internship-johor
https://www.maukerja.my/job?jobId=26409008&slug=internship-trainees-admin,N/A,Internship Trainees - Admin,Cycle & Carriage Bintang Berhad,"MYR1,000 - MYR1,200 Sebulan",Latihan Industri,Johor Bahru,3 days ago,N/A,internship-johor
N/A,N/A,N/A,N/A,N/A,N/A,N/A,N/A,N/A,internship-johor
https://www.maukerja.my/job?jobId=26408363&slug=qc-internship,N/A,QC Internship,ECOLITE BIOTECH MANUFACTURING SDN BHD,MYR700 - MYR700 Sebulan,Latihan Industri,Malaysia,3 days ago,N/A,internship-johor
https://www.maukerja.my/job?jobId=26399266&slug=internship-it-department,N/A,Internship - IT Department,Trove Johor Bahru,Undisclosed,Latihan Industri,Johor Bahru,5 days ago,N/A,internship-johor
https://www.maukerja.my/job?jobId=26399263&slug=internship-human-resources-department,N/A,Internship - Human Resources Department,Trove Johor Bahru,Undisclosed,Latihan Industri,Johor Bahru,5 days ago,N/A,internship-johor
https://www.maukerja.my/job?jobId=26398822&slug=project-executive,N/A,Project Executive,Laubros Holdings (M) Sdn Bhd,"MYR2,800 - MYR4,000 Sebulan","Latihan Industri,",Johor Bahru,5 days ago,N/A,internship-johor
https://www.maukerja.my/job?jobId=26398825&slug=internship-hr-and-admin,N/A,Internship HR and Admin,Laubros Holdings (M) Sdn Bhd,"MYR1,000 - MYR1,000 Sebulan",Latihan Industri,Johor Bahru,5 days ago,N/A,internship-johor
https://www.maukerja.my/job?jobId=26398821&slug=purchaser-purchasing-assistant-manager-constructions,N/A,Purchaser-Purchasing Assistant Manager (Constructions),Laubros Holdings (M) Sdn Bhd,"MYR3,000 - MYR7,000 Sebulan","Latihan Industri,",Johor Bahru,5 days ago,N/A,internship-johor
https://www.maukerja.my/job?jobId=26398814&slug=internship-trainee-mechanical-electrical-engineering,N/A,Internship trainee ( Mechanical - Electrical Engineering),Laubros Holdings (M) Sdn Bhd,"MYR1,000 - MYR1,000 Sebulan",Latihan Industri,Johor Bahru,5 days ago,N/A,internship-johor
https://www.maukerja.my/job?jobId=26398820&slug=internship-trainee-quantity-surveyor,N/A,Internship Trainee (Quantity Surveyor),Laubros Holdings (M) Sdn Bhd,"MYR1,000 - MYR1,000 Sebulan","Latihan Industri,",Johor Bahru,5 days ago,N/A,internship-johor
https://www.maukerja.my/job?jobId=26398815&slug=internship-trainee-civil-engineering,N/A,Internship Trainee (Civil engineering),Laubros Holdings (M) Sdn Bhd,"MYR1,000 - MYR1,000 Sebulan",Latihan Industri,Johor Bahru,5 days ago,N/A,internship-johor
https://www.maukerja.my/job?jobId=26398817&slug=account-assistant-internship,N/A,Account Assistant (internship),Laubros Holdings (M) Sdn Bhd,"MYR1,000 - MYR1,000 Sebulan",Latihan Industri,Johor Bahru,5 days ago,N/A,internship-johor
